{
  "version": 1,
  "defaults": {
    "provider": "anthropic",
    "model": "claude-sonnet-5",
    "maxTokens": 1200,
    "temperature": 0.1
  },
  "agents": {
    "books_review": {},
    "contract_review": {},
    "shelf_review": {},
    "payroll_explainer": {
      "provider": "ollama",
      "endpoint": "http://localhost:11434/api/chat",
      "model": "llama3.1:8b",
      "maxTokens": 700,
      "temperature": 0
    }
  },
  "policy": {
    "allowedProviders": ["anthropic", "ollama"],
    "allowCloudFallback": false,
    "requireHumanApproval": true,
    "allowExecutedActions": false,
    "payroll": {
      "modelMayCalculatePay": false,
      "cloudFallbackAllowed": false
    }
  }
}
